{
  "$schema": "https://json-schema.org/draft/2020-12/schema",
  "$id": "https://github.com/lfnavarroj1/sport-app-platform/schemas/frontend-release.schema.json",
  "title": "frontend-release.json",
  "description": "Evidencia que publica cloudbuild.release.yaml de sport-app-frontend (deploy/release/release-manifest.mjs, tipo frontend-release) y que acepta el promotor de la plataforma.",
  "type": "object",
  "additionalProperties": false,
  "required": ["schemaVersion", "kind", "repository", "component", "version", "tag", "commit", "expectedBffContract", "artifact", "checks", "smokeTest", "image", "cloudBuild", "createdAt"],
  "properties": {
    "schemaVersion": { "const": "1.0" },
    "kind": { "const": "frontend-release" },
    "repository": { "const": "lfnavarroj1/sport-app-frontend" },
    "component": { "const": "web" },
    "version": { "$ref": "#/$defs/semver" },
    "tag": { "$ref": "#/$defs/tag" },
    "commit": { "type": "string", "pattern": "^[0-9a-f]{40}$" },
    "expectedBffContract": {
      "type": "object",
      "additionalProperties": false,
      "required": ["name", "version", "sha256"],
      "properties": {
        "name": { "const": "bff-web" },
        "version": { "$ref": "#/$defs/semver" },
        "sha256": { "$ref": "#/$defs/sha256" }
      }
    },
    "artifact": {
      "description": "Sitio compilado: su checksum sha256.",
      "type": "object",
      "additionalProperties": false,
      "required": ["name", "sha256", "source"],
      "properties": {
        "name": { "type": "string", "minLength": 1 },
        "sha256": { "$ref": "#/$defs/sha256" },
        "source": { "type": "string", "minLength": 1 }
      }
    },
    "checks": {
      "type": "array",
      "minItems": 1,
      "items": {
        "type": "object",
        "additionalProperties": false,
        "required": ["name", "command", "status"],
        "properties": {
          "name": { "type": "string", "minLength": 1 },
          "command": { "type": "string", "minLength": 1 },
          "status": { "const": "passed" }
        }
      }
    },
    "smokeTest": {
      "type": "object",
      "additionalProperties": false,
      "required": ["status", "script", "scriptSha256", "checksPassed"],
      "properties": {
        "status": { "const": "passed" },
        "script": { "type": "string", "minLength": 1 },
        "scriptSha256": { "$ref": "#/$defs/sha256" },
        "checksPassed": { "type": "integer", "minimum": 1 }
      }
    },
    "image": {
      "type": "object",
      "additionalProperties": false,
      "required": ["uri", "digest"],
      "properties": {
        "uri": { "type": "string", "pattern": "^[a-z0-9-]+-docker\\.pkg\\.dev/[a-z][a-z0-9-]+/sportapp-frontend/web@sha256:[0-9a-f]{64}$" },
        "digest": { "type": "string", "pattern": "^sha256:[0-9a-f]{64}$" }
      }
    },
    "cloudBuild": {
      "type": "object",
      "additionalProperties": false,
      "required": ["buildId", "projectId", "location"],
      "properties": {
        "buildId": { "type": "string", "pattern": "^[0-9a-f-]{8,64}$" },
        "projectId": { "type": "string", "pattern": "^[a-z][a-z0-9-]{4,28}[a-z0-9]$" },
        "location": { "type": "string", "minLength": 1 }
      }
    },
    "createdAt": { "type": "string", "pattern": "^\\d{4}-\\d{2}-\\d{2}T\\d{2}:\\d{2}:\\d{2}Z$" }
  },
  "$defs": {
    "semver": { "type": "string", "pattern": "^(0|[1-9][0-9]*)\\.(0|[1-9][0-9]*)\\.(0|[1-9][0-9]*)(-[0-9A-Za-z-]+(\\.[0-9A-Za-z-]+)*)?$" },
    "tag": { "type": "string", "pattern": "^v(0|[1-9][0-9]*)\\.(0|[1-9][0-9]*)\\.(0|[1-9][0-9]*)(-[0-9A-Za-z-]+(\\.[0-9A-Za-z-]+)*)?$" },
    "sha256": { "type": "string", "pattern": "^[0-9a-f]{64}$" }
  }
}
